{
  "version": 1,
  "network": "Crosslink v14",
  "anchor": "zfinv1GZdz080ldpk_4Tpuv6ffe7-og7KHi2R5ZGWEu7S9iBxQVNfwSeZmudklFTZR4c4FAAkFV8If2ozpyvaFu93-gwrvuME617wwnai1s0FN7b_c5HhR_CsBKrJIG-nJXuAG",
  "name": "Update Flow Test",
  "description": "Throwaway claim to test the update flow. Removed after the test.",
  "block": {
    "height": 42771,
    "hash": "00002b04ed1d362514767c0760762038bbcc8239ed867089a273a45f3d0fa336"
  },
  "pubkey": "199773d3cd2576993fe13a6ebfa7df7bbfa883b2878b6479646584bbb4bd881c",
  "signature": "5bc6f1dc6adb294cd9253cec38ab65220706464448e4a91027a00611090befd23d90990ce13232c21a85dc24686deaeeaa56d98b1d9c89d2f4e65c3fbff5e506"
}
