{
  "version": 1,
  "network": "Crosslink v14",
  "anchor": "zfinv1S9hmFd7fEMjAfxvNCl-NhUQfZxdiK2-Spb1xRuXaFftjEOYXKhmUoU9ixkMfSN11WlEiA22_XUdcdtg4x0vIEvdVieB4d7ShWGG9shJPqoU8HUdSb0WxpBA0_tIuF-QP",
  "name": "Ironwood Guardian",
  "block": {
    "height": 51005,
    "hash": "0000055282151cc8d9b2f4d8c35e58f1316d477592356daaea352b53d91df95b"
  },
  "pubkey": "4bd86615dedf10c8c07f1bcd0a5f8d85441f6717622b6f92a5bd7146e5da15fb",
  "signature": "06d5223e3099a4c58780a9a0f16b1fee587fa7a720f6c596026764cf2691d6b0bbd301f1c251d4d78831c914dd06a1342dfe326d35f7de05af2ea4104ad65501"
}
